{"schemaVersion":"1.0.0","guideId":"synthetic-guide-demo-001","sourceId":"synthetic-source-demo-001","authorClaims":[{"claimId":"claim-advice-1","paraphrase":"经济达到十时可考虑保留资源。","locator":"paragraph:1","stableIds":["archetype_demo"]}],"factualClaims":[{"claimId":"claim-fact-1","paraphrase":"本记录为合成测试数据，不代表游戏事实。","locator":"paragraph:1","stableIds":[]}],"sourceExtensions":{"synthetic":true}}
